StartDate,EndDate,Status,IPAddress,Progress,Duration (in seconds),Finished,RecordedDate,ResponseId,RecipientLastName,RecipientFirstName,RecipientEmail,ExternalReference,LocationLatitude,LocationLongitude,DistributionChannel,UserLanguage,Consent Form,consent-time_First Click,consent-time_Last Click,consent-time_Page Submit,consent-time_Click Count,covid-vaccine,covid-vaccine-doses,covid-infection,covid-time_First Click,covid-time_Last Click,covid-time_Page Submit,covid-time_Click Count,simple-bar-initial,sim-bar-initial-time_First Click,sim-bar-initial-time_Last Click,sim-bar-initial-time_Page Submit,sim-bar-initial-time_Click Count,simple-bar-tour-time_First Click,simple-bar-tour-time_Last Click,simple-bar-tour-time_Page Submit,simple-bar-tour-time_Click Count,simple-bar-vlat-1,simple-bar-vlat-2_4,simple-bar-vlat-2_5,sim-bar-vlat-time_First Click,sim-bar-vlat-time_Last Click,sim-bar-vlat-time_Page Submit,sim-bar-vlat-time_Click Count,simple-bar-data_1,simple-bar-data_2,simple-bar-data_3,simple-bar-data_4,simple-bar-data_5,simple-bar-data_6,simple-bar-data-exp,simple-bar-data-time_First Click,simple-bar-data-time_Last Click,simple-bar-data-time_Page Submit,simple-bar-data-time_Click Count,simple-bar-vis_1,simple-bar-vis_2,simple-bar-vis_3,simple-bar-vis_4,simple-bar-vis_5,simple-bar-vis_6,simple-bar-why,simple-bar-vis-time_First Click,simple-bar-vis-time_Last Click,simple-bar-vis-time_Page Submit,simple-bar-vis-time_Click Count,moderate-bar-initial,mod-bar-initial-time_First Click,mod-bar-initial-time_Last Click,mod-bar-initial-time_Page Submit,mod-bar-initial-time_Click Count,mod-bar-tour-time_First Click,mod-bar-tour-time_Last Click,mod-bar-tour-time_Page Submit,mod-bar-tour-time_Click Count,moderate-bar-vlat-1,moderate-bar-vlat-2,mod-bar-vlat-time_First Click,mod-bar-vlat-time_Last Click,mod-bar-vlat-time_Page Submit,mod-bar-vlat-time_Click Count,moderate-bar-data_1,moderate-bar-data_2,moderate-bar-data_3,moderate-bar-data_4,moderate-bar-data_5,moderate-bar-data_6,mod-bar-data-exp,mod-bar-data-time_First Click,mod-bar-data-time_Last Click,mod-bar-data-time_Page Submit,mod-bar-data-time_Click Count,moderate-bar-vis_1,moderate-bar-vis_2,moderate-bar-vis_3,moderate-bar-vis_4,moderate-bar-vis_5,moderate-bar-vis_6,moderate-bar-why,mod-bar-vis-time_First Click,mod-bar-vis-time_Last Click,mod-bar-vis-time_Page Submit,mod-bar-vis-time_Click Count,complex-bar-initial,com-bar-initial-time_First Click,com-bar-initial-time_Last Click,com-bar-initial-time_Page Submit,com-bar-initial-time_Click Count,comp-bar-tour-time_First Click,comp-bar-tour-time_Last Click,comp-bar-tour-time_Page Submit,comp-bar-tour-time_Click Count,complex-bar-vlat-1,comp-bar-vlat-time_First Click,comp-bar-vlat-time_Last Click,comp-bar-vlat-time_Page Submit,comp-bar-vlat-time_Click Count,complex-bar-data_1,complex-bar-data_2,complex-bar-data_3,complex-bar-data_4,complex-bar-data_5,complex-bar-data_6,comp-bar-data-exp,comp-bar-data-time_First Click,comp-bar-data-time_Last Click,comp-bar-data-time_Page Submit,comp-bar-data-time_Click Count,complex-bar-vis_1,complex-bar-vis_2,complex-bar-vis_3,complex-bar-vis_4,complex-bar-vis_5,complex-bar-vis_6,complex-bar-why,comp-bar-vis-time_First Click,comp-bar-vis-time_Last Click,comp-bar-vis-time_Page Submit,comp-bar-vis-time_Click Count,interpersonal-trust_1,interper-trust-exp,interper-trust-time_First Click,interper-trust-time_Last Click,interper-trust-time_Page Submit,interper-trust-time_Click Count,Q32_1,Q32_2,Q32_3,Q32_4,Q32_5,Q32_6,Q32_7,Q32_8,Q61_First Click,Q61_Last Click,Q61_Page Submit,Q61_Click Count,trust-in-science_1,trust-in-science_2,trust-in-science_3,trust-in-science_4,trust-in-science_5,trust-in-science_6,trust-in-science_7,trust-in-science_8,trust-science-exp,trust-science-time_First Click,trust-science-time_Last Click,trust-science-time_Page Submit,trust-science-time_Click Count,cognition_1,cognition_2,cognition_3,cognition_4,cognition_5,cognition_6,need-cognition-time_First Click,need-cognition-time_Last Click,need-cognition-time_Page Submit,need-cognition-time_Click Count,political_views,covid_information,politics_time_First Click,politics_time_Last Click,politics_time_Page Submit,politics_time_Click Count,Gemder,Age,State_1,Education,Parents_education,Language,Language_4_TEXT,Ethnicity,Ethnicity_8_TEXT,Ethnicity_9_TEXT,Income,Religion,Interview,Interview_1_TEXT,demographics_time_First Click,demographics_time_Last Click,demographics_time_Page Submit,demographics_time_Click Count,simple-lin-initial,simple-lin-data_1,simple-lin-data_2,simple-lin-data_3,simple-lin-data_4,simple-lin-data_5,simple-lin-data_6,simple-lin-vis_1,simple-lin-vis_2,simple-lin-vis_3,simple-lin-vis_4,simple-lin-vis_5,simple-lin-vis_6,simple-lin-why,Q142_First Click,Q142_Last Click,Q142_Page Submit,Q142_Click Count,moderate-lin-initial,moderate-lin-data_1,moderate-lin-data_2,moderate-lin-data_3,moderate-lin-data_4,moderate-lin-data_5,moderate-lin-data_6,moderate-lin-vis_1,moderate-lin-vis_2,moderate-lin-vis_3,moderate-lin-vis_4,moderate-lin-vis_5,moderate-lin-vis_6,moderate-lin-why,Q147_First Click,Q147_Last Click,Q147_Page Submit,Q147_Click Count,complex-lin-initial,complex-lin-data_1,complex-lin-data_2,complex-lin-data_3,complex-lin-data_4,complex-lin-data_5,complex-lin-data_6,complex-lin-vis_1,complex-lin-vis_2,complex-lin-vis_3,complex-lin-vis_4,complex-lin-vis_5,complex-lin-vis_6,complex-lin-why,Q152_First Click,Q152_Last Click,Q152_Page Submit,Q152_Click Count,PROLIFIC_PID,provenance-simple-bar-initial,provenance-simple-bar-data,provenance-simple-bar-vis,provenance-moderate-bar-initial,provenance-moderate-bar-data,provenance-moderate-bar-vis,provenance-complex-bar-initial,provenance-complex-bar-data,provenance-complex-bar-vis,provenance-simple-bar-tour,provenance-moderate-bar-tour,provenance-complex-bar-tour
Start Date,End Date,Response Type,IP Address,Progress,Duration (in seconds),Finished,Recorded Date,Response ID,Recipient Last Name,Recipient First Name,Recipient Email,External Data Reference,Location Latitude,Location Longitude,Distribution Channel,User Language,"Consent Form for Participation in a Research Study

 

Principal Investigators:Dr. Carolina Nobre, Assistant Professor at University of Toronto and  Dr. Cindy Xiong, Assistant Professor at University of Masschusetts Amherst 

Study Title: Data Communication and Trust in Science

Supported By: University of Toronto, University of Massachusetts Amherst, and Harvard University

 

WHAT IS THIS FORM?

This form is called a Consent Form. It will give you information about the study so you can make an informed decision about participation in this research. We encourage you to take some time to think this over and ask questions now and at any other time. If you decide to participate, you will be asked to sign this form and you will be given a copy for your records.
 

WHAT ARE SOME OF THE IMPORTANT ASPECTS OF THIS RESEARCH STUDY THAT I SHOULD BE AWARE OF?


	
	Whether or not you take part is up to you.
	
	
	You can choose not to take part.
	
	
	You can agree to take part and later change your mind.
	
	
	Your decision will not be held against you.
	

 

WHY ARE WE DOING THIS RESEARCH STUDY?

The purpose of our study is to explore how people process information in the age of misinformation. Particularly, we are investigating aspects of trust in Covid-19 related visualizations. 
 

WHO CAN PARTICIPATE IN THIS RESEARCH STUDY?

Any person who is at least 18 years of age may participate in this research study.
 

HOW MANY PEOPLE WILL PARTICIPATE?

We expect about 1000 people will be in this research study.
 

WHAT WILL I BE ASKED TO DO AND HOW MUCH TIME WILL IT TAKE?

We will be shown different visualizations containing COVID-19 data and you will be asked questions regarding the visualization, your understanding, impressions, etc. . We expect this research study to take around 20 minutes. At the end of the survey, you will be given the choice to to opt-in to a follow up study on the topic. This is completely optional and will not interfere with the current study.  
 

WILL BEING IN THIS RESEARCH STUDY HELP ME IN ANY WAY? 

You are not likely to have any direct benefit from being in this research study. The potential benefits to you from participation may include learning about how data visualization research is conducted, and you may learn about issues of current interest in data visualization.
 

WHAT ARE MY RISKS OF BEING IN THIS RESEARCH STUDY? 

Your participation in this study does not involve any risks other than what you would encounter in daily life. The effects of participating should be comparable to those you would experience from viewing a computer monitor and using a keyboard. You may withdraw at any time.
 

HOW WILL MY PERSONAL INFORMATION BE PROTECTED? 

Efforts will be made to limit the use and disclosure of your personal information, including research study records, to people who have a need to review this information. We cannot promise complete secrecy. Organizations that may inspect and copy your information include the IRB and other representatives of this institution. 

 

Data Sharing: De-identified data from this study will be shared among the UMass Amherst and University of Toronto research teams, as well as the research community at large to advance science and health. We will remove or code any personal information that could identify you before files are shared with other researchers to ensure that, by current scientific standards and known methods, no one will be able to identify you from the information we share. 
 

WHO CAN I TALK TO IF I HAVE QUESTIONS?

If you have questions about this project or if you have a research-related problem, you may contact the Principal Investigator, Dr. Carolina Nobre, at cnobre@cs.toronto.edu. 

 

WHAT HAPPENS IF I SAY YES, BUT I CHANGE MY MIND LATER?

You can decide not to participate in this research or you can start and then decide to leave the research at any time and it will not be held against you. To do so, simply exit the experiment.  Any data already collected will not be saved.

 

By clicking “I agree” below you are indicating that you are at least 18 years old, have read this consent form, and agree to participate in this research study. Please print a copy of this page for your records.",Timing - First Click,Timing - Last Click,Timing - Page Submit,Timing - Click Count,Have you already received a Covid-19 vaccination?,How many doses of the Covid-19 vaccine did you receive?,Have you been verifiably infected with Covid-19?,Timing - First Click,Timing - Last Click,Timing - Page Submit,Timing - Click Count,"Above you see two bar charts containing information about Covid-19 cases in the USA. 



What are your first/immediate impressions of this visualization? 
This could include things you like, dislike, as well as other first impressions.",Timing - First Click,Timing - Last Click,Timing - Page Submit,Timing - Click Count,Timing - First Click,Timing - Last Click,Timing - Page Submit,Timing - Click Count,"Using the static (no mouseover or interaction) version of the visualization above, please answer the following question:

 
 How many weeks had higher unvaccinated Covid-19 case counts than the week of Dec 13, 2021?","Using the static (no mouseover or interaction) version of the visualization above, please answer the following question: 

 

What is the approximate range of case counts of vaccinated people who caught Covid-19? - Lowest Number of Covid Cases","Using the static (no mouseover or interaction) version of the visualization above, please answer the following question: 

 

What is the approximate range of case counts of vaccinated people who caught Covid-19? - Highest Number of Covid Cases",Timing - First Click,Timing - Last Click,Timing - Page Submit,Timing - Click Count,Disregard the visualization for this question. To what extent do you agree or disagree with the following statements about the data used in the visualization  above? - The data is accurate,Disregard the visualization for this question. To what extent do you agree or disagree with the following statements about the data used in the visualization  above? - The data sufficiently describes the current state of COVID-19 vaccinations (the data is complete and does not leave out important information),Disregard the visualization for this question. To what extent do you agree or disagree with the following statements about the data used in the visualization  above? - The data is unbiased and trustworthy,Disregard the visualization for this question. To what extent do you agree or disagree with the following statements about the data used in the visualization  above? - I understand the meaning of this data well,Disregard the visualization for this question. To what extent do you agree or disagree with the following statements about the data used in the visualization  above? - The data source was clearly displayed,Disregard the visualization for this question. To what extent do you agree or disagree with the following statements about the data used in the visualization  above? - I trust this data,"If you have any additional thoughts/comments, please enter them here.",Timing - First Click,Timing - Last Click,Timing - Page Submit,Timing - Click Count,Assume you trust the data used for the visualization. To what extent do you agree or disagree with the following statements about the visualization presented above? - The visualization transparently includes all important elements of the data,Assume you trust the data used for the visualization. To what extent do you agree or disagree with the following statements about the visualization presented above? - I find it easy to understand this visualization,Assume you trust the data used for the visualization. To what extent do you agree or disagree with the following statements about the visualization presented above? - I like this visualization,"Assume you trust the data used for the visualization. To what extent do you agree or disagree with the following statements about the visualization presented above? - I would likely share this visualization with my family, friends or on social media",Assume you trust the data used for the visualization. To what extent do you agree or disagree with the following statements about the visualization presented above? - I would likely use this visualization and its information in my actions tackling Covid-19,Assume you trust the data used for the visualization. To what extent do you agree or disagree with the following statements about the visualization presented above? - I trust this visualization,"Tell us a bit more about why you  [QID102-ChoiceGroup-SelectedAnswers-11]  with the  statement ""I trust this visualization"".",Timing - First Click,Timing - Last Click,Timing - Page Submit,Timing - Click Count,"Above you see a stacked bar chart containing information about Covid-19 cases in the USA. 


What are your first/immediate impressions of this visualization? This could include things you like, dislike, as well as other first impressions.",Timing - First Click,Timing - Last Click,Timing - Page Submit,Timing - Click Count,Timing - First Click,Timing - Last Click,Timing - Page Submit,Timing - Click Count,"Using the static (no mouseover or interaction) version of the visualization above, please answer the following question:

 
By approximately how much did the number of cases in unvaccinated people increase from the week of December 13, 2021 to the week of December 20, 2021?","Using the static (no mouseover or interaction) version of the visualization above, please answer the following question:

 
Approximately how many unvaccinated people caught Covid-19 during the week of January 10, 2022?",Timing - First Click,Timing - Last Click,Timing - Page Submit,Timing - Click Count,"Disregard the visualization for this question.
 To what extent do you agree or disagree with the following statements about the data used in the visualization  above? - The data is accurate","Disregard the visualization for this question.
 To what extent do you agree or disagree with the following statements about the data used in the visualization  above? - The data sufficiently describes the current state of COVID-19 vaccinations (the data is complete and does not leave out important information)","Disregard the visualization for this question.
 To what extent do you agree or disagree with the following statements about the data used in the visualization  above? - The data is unbiased and trustworthy","Disregard the visualization for this question.
 To what extent do you agree or disagree with the following statements about the data used in the visualization  above? - I understand the meaning of this data well","Disregard the visualization for this question.
 To what extent do you agree or disagree with the following statements about the data used in the visualization  above? - The data source was clearly displayed","Disregard the visualization for this question.
 To what extent do you agree or disagree with the following statements about the data used in the visualization  above? - I trust this data","If you have any additional thoughts/comments, please enter them here.",Timing - First Click,Timing - Last Click,Timing - Page Submit,Timing - Click Count,Assume you trust the data used for the visualization. To what extent do you agree or disagree with the following statements about the visualization presented above? - The visualization transparently includes all important elements of the data,Assume you trust the data used for the visualization. To what extent do you agree or disagree with the following statements about the visualization presented above? - I find it easy to understand this visualization,Assume you trust the data used for the visualization. To what extent do you agree or disagree with the following statements about the visualization presented above? - I like this visualization,"Assume you trust the data used for the visualization. To what extent do you agree or disagree with the following statements about the visualization presented above? - I would likely share this visualization with my family, friends or on social media",Assume you trust the data used for the visualization. To what extent do you agree or disagree with the following statements about the visualization presented above? - I would likely use this visualization and its information in my actions tackling Covid-19,Assume you trust the data used for the visualization. To what extent do you agree or disagree with the following statements about the visualization presented above? - I trust this visualization,"Tell us a bit more about why you  [QID129-ChoiceGroup-SelectedAnswers-11]  with the  statement ""I trust this visualization"".",Timing - First Click,Timing - Last Click,Timing - Page Submit,Timing - Click Count,"Above you see a stacked bar chart containing information about Covid-19 cases in the USA. 


What are your first/immediate impressions of this visualization? This could include things you like, dislike, as well as other first impressions.",Timing - First Click,Timing - Last Click,Timing - Page Submit,Timing - Click Count,Timing - First Click,Timing - Last Click,Timing - Page Submit,Timing - Click Count,"Using the static (no mouseover or interaction) version of the visualization above, please answer the following question:

 
Among vaccinated people, which age group sees the quickest increase in case count between November 2021 and January 2022?",Timing - First Click,Timing - Last Click,Timing - Page Submit,Timing - Click Count,Disregard the visualization for this question. To what extent do you agree or disagree with the following statements about the data used in the visualization  above? - The data is accurate,Disregard the visualization for this question. To what extent do you agree or disagree with the following statements about the data used in the visualization  above? - The data sufficiently describes the current state of COVID-19 vaccinations (the data is complete and does not leave out important information),Disregard the visualization for this question. To what extent do you agree or disagree with the following statements about the data used in the visualization  above? - The data is unbiased and trustworthy,Disregard the visualization for this question. To what extent do you agree or disagree with the following statements about the data used in the visualization  above? - I understand the meaning of this data well,Disregard the visualization for this question. To what extent do you agree or disagree with the following statements about the data used in the visualization  above? - The data source was clearly displayed,Disregard the visualization for this question. To what extent do you agree or disagree with the following statements about the data used in the visualization  above? - I trust this data,"If you have any additional thoughts/comments, please enter them here.",Timing - First Click,Timing - Last Click,Timing - Page Submit,Timing - Click Count,Assume you trust the data used for the visualization. To what extent do you agree or disagree with the following statements about the visualization presented above? - The visualization transparently includes all important elements of the data,Assume you trust the data used for the visualization. To what extent do you agree or disagree with the following statements about the visualization presented above? - I find it easy to understand this visualization,Assume you trust the data used for the visualization. To what extent do you agree or disagree with the following statements about the visualization presented above? - I like this visualization,"Assume you trust the data used for the visualization. To what extent do you agree or disagree with the following statements about the visualization presented above? - I would likely share this visualization with my family, friends or on social media",Assume you trust the data used for the visualization. To what extent do you agree or disagree with the following statements about the visualization presented above? - I would likely use this visualization and its information in my actions tackling Covid-19,Assume you trust the data used for the visualization. To what extent do you agree or disagree with the following statements about the visualization presented above? - I trust this visualization,"Tell us a bit more about why you  [QID134-ChoiceGroup-SelectedAnswers-11] with the  statement ""I trust this visualization"".",Timing - First Click,Timing - Last Click,Timing - Page Submit,Timing - Click Count,"Generally speaking, would you say that most people can be trusted or that you can't be too careful in dealing with people? - 2","If you have any additional thoughts/comments, please enter them here.",Timing - First Click,Timing - Last Click,Timing - Page Submit,Timing - Click Count,There are many important issues facing our country today. Research shows that issues people think are important can affect their views on other issues. We also want to know if you are paying attention. Please ignore the question and put “crime” in the top position and unemployment in the bottom position. Leave the rest of the issues in the same order. - Health care,There are many important issues facing our country today. Research shows that issues people think are important can affect their views on other issues. We also want to know if you are paying attention. Please ignore the question and put “crime” in the top position and unemployment in the bottom position. Leave the rest of the issues in the same order. - Unemployment,There are many important issues facing our country today. Research shows that issues people think are important can affect their views on other issues. We also want to know if you are paying attention. Please ignore the question and put “crime” in the top position and unemployment in the bottom position. Leave the rest of the issues in the same order. - The federal budget deficit,There are many important issues facing our country today. Research shows that issues people think are important can affect their views on other issues. We also want to know if you are paying attention. Please ignore the question and put “crime” in the top position and unemployment in the bottom position. Leave the rest of the issues in the same order. - The coronavirus pandemic,There are many important issues facing our country today. Research shows that issues people think are important can affect their views on other issues. We also want to know if you are paying attention. Please ignore the question and put “crime” in the top position and unemployment in the bottom position. Leave the rest of the issues in the same order. - Crime,There are many important issues facing our country today. Research shows that issues people think are important can affect their views on other issues. We also want to know if you are paying attention. Please ignore the question and put “crime” in the top position and unemployment in the bottom position. Leave the rest of the issues in the same order. - Education,There are many important issues facing our country today. Research shows that issues people think are important can affect their views on other issues. We also want to know if you are paying attention. Please ignore the question and put “crime” in the top position and unemployment in the bottom position. Leave the rest of the issues in the same order. - Relations with other countries,There are many important issues facing our country today. Research shows that issues people think are important can affect their views on other issues. We also want to know if you are paying attention. Please ignore the question and put “crime” in the top position and unemployment in the bottom position. Leave the rest of the issues in the same order. - Click to write Item 8,Timing - First Click,Timing - Last Click,Timing - Page Submit,Timing - Click Count,"On  a  scale  of  0  to  10,  how  much  do  you  personally  trust  each  of  the following  institutions?  0  means  you  do  not  trust  an  institution  at  all,  and  10  means  you  trust  it completely. - Political parties","On  a  scale  of  0  to  10,  how  much  do  you  personally  trust  each  of  the following  institutions?  0  means  you  do  not  trust  an  institution  at  all,  and  10  means  you  trust  it completely. - The government","On  a  scale  of  0  to  10,  how  much  do  you  personally  trust  each  of  the following  institutions?  0  means  you  do  not  trust  an  institution  at  all,  and  10  means  you  trust  it completely. - The police","On  a  scale  of  0  to  10,  how  much  do  you  personally  trust  each  of  the following  institutions?  0  means  you  do  not  trust  an  institution  at  all,  and  10  means  you  trust  it completely. - The legal system","On  a  scale  of  0  to  10,  how  much  do  you  personally  trust  each  of  the following  institutions?  0  means  you  do  not  trust  an  institution  at  all,  and  10  means  you  trust  it completely. - The news media","On  a  scale  of  0  to  10,  how  much  do  you  personally  trust  each  of  the following  institutions?  0  means  you  do  not  trust  an  institution  at  all,  and  10  means  you  trust  it completely. - Business and industry","On  a  scale  of  0  to  10,  how  much  do  you  personally  trust  each  of  the following  institutions?  0  means  you  do  not  trust  an  institution  at  all,  and  10  means  you  trust  it completely. - Scientists/Science","On  a  scale  of  0  to  10,  how  much  do  you  personally  trust  each  of  the following  institutions?  0  means  you  do  not  trust  an  institution  at  all,  and  10  means  you  trust  it completely. - Doctors","If you have any additional thoughts/comments, please enter them here.",Timing - First Click,Timing - Last Click,Timing - Page Submit,Timing - Click Count,"The next questions will be about your motivation to engage in cognitive activity. For each sentence below, please select how uncharacteristic or characteristic (5-point scale) this is for you personally. - I would prefer complex to simple problems.","The next questions will be about your motivation to engage in cognitive activity. For each sentence below, please select how uncharacteristic or characteristic (5-point scale) this is for you personally. - I like to have the responsibility of handling a situation that requires a lot of thinking.","The next questions will be about your motivation to engage in cognitive activity. For each sentence below, please select how uncharacteristic or characteristic (5-point scale) this is for you personally. - Thinking is not my idea of fun.","The next questions will be about your motivation to engage in cognitive activity. For each sentence below, please select how uncharacteristic or characteristic (5-point scale) this is for you personally. - I would rather do something that requires little thought than something that is sure to challenge my thinking abilities.","The next questions will be about your motivation to engage in cognitive activity. For each sentence below, please select how uncharacteristic or characteristic (5-point scale) this is for you personally. - I really enjoy a task that involves coming up with new solutions to problems.","The next questions will be about your motivation to engage in cognitive activity. For each sentence below, please select how uncharacteristic or characteristic (5-point scale) this is for you personally. - I would prefer a task that is intellectual, difficult, and important to one that is somewhat important but does not require much thought.",Timing - First Click,Timing - Last Click,Timing - Page Submit,Timing - Click Count,Below is a seven-point scale on which the political views that people might hold are arranged from extremely liberal—point 1—to extremely conservative—point 7. Where would you place yourself on this scale?,"During the peak of the pandemic, how often did you actively seek information on Covid-19 from any sources including TV, newspapers, radios, online and social media, or personal conversations?",Timing - First Click,Timing - Last Click,Timing - Page Submit,Timing - Click Count,Lastly a few questions about socio-demographic characteristics. To which gender do you most identify?,In what year were you born? Please enter all four digits.,Text,What is the highest level of school you have completed or the highest degree you have received?,Have one or both of your parents completed a bachelor’s degree?,What language do you speak at home? - Selected Choice,"What language do you speak at home? - Other, please specify: - Text",Which of the following categories do you identify with? - Selected Choice,"Which of the following categories do you identify with? - Other race, ethnicity, or origin (please specify) - Text","Which of the following categories do you identify with? - Mixed race, ethnicity (please specify) - Text","In which of these groups did your total family income, from all sources, fall last year before taxes?",To what extent do you consider yourself a religious person?,Would you be interested in participating in a qualitative interview for this study? You would be paid $15 for about 30 minutes of your time. - Selected Choice,"Would you be interested in participating in a qualitative interview for this study? You would be paid $15 for about 30 minutes of your time. - Yes, you may contact me on this email address: - Text",Timing - First Click,Timing - Last Click,Timing - Page Submit,Timing - Click Count,"Above you see a chart containing information about Covid-19 cases in the USA.


What are your first/immediate impressions of this visualization? This could include things you like, dislike, as well as other first impressions.","Above you see a chart containing information about Covid-19 cases in the USA. Please look at the chart and answer the question below.


Disregard the visualization for this question. To what extent do you agree or disagree with the following statements about the data used in the visualization  above? - The data is accurate","Above you see a chart containing information about Covid-19 cases in the USA. Please look at the chart and answer the question below.


Disregard the visualization for this question. To what extent do you agree or disagree with the following statements about the data used in the visualization  above? - The data sufficiently describes the current state of COVID-19 vaccinations (the data is complete and does not leave out important information)","Above you see a chart containing information about Covid-19 cases in the USA. Please look at the chart and answer the question below.


Disregard the visualization for this question. To what extent do you agree or disagree with the following statements about the data used in the visualization  above? - The data is unbiased and trustworthy","Above you see a chart containing information about Covid-19 cases in the USA. Please look at the chart and answer the question below.


Disregard the visualization for this question. To what extent do you agree or disagree with the following statements about the data used in the visualization  above? - I understand the meaning of this data well","Above you see a chart containing information about Covid-19 cases in the USA. Please look at the chart and answer the question below.


Disregard the visualization for this question. To what extent do you agree or disagree with the following statements about the data used in the visualization  above? - The data source was clearly displayed","Above you see a chart containing information about Covid-19 cases in the USA. Please look at the chart and answer the question below.


Disregard the visualization for this question. To what extent do you agree or disagree with the following statements about the data used in the visualization  above? - I trust this data","Above you see a chart containing information about Covid-19 cases in the USA.  Please look at the chart and answer the question below.

Assume you trust the data used for the visualization. To what extent do you agree or disagree with the following statements about the visualization presented above? - The visualization transparently includes all important elements of the data","Above you see a chart containing information about Covid-19 cases in the USA.  Please look at the chart and answer the question below.

Assume you trust the data used for the visualization. To what extent do you agree or disagree with the following statements about the visualization presented above? - I find it easy to understand this visualization","Above you see a chart containing information about Covid-19 cases in the USA.  Please look at the chart and answer the question below.

Assume you trust the data used for the visualization. To what extent do you agree or disagree with the following statements about the visualization presented above? - I like this visualization","Above you see a chart containing information about Covid-19 cases in the USA.  Please look at the chart and answer the question below.

Assume you trust the data used for the visualization. To what extent do you agree or disagree with the following statements about the visualization presented above? - I would likely share this visualization with my family, friends or on social media","Above you see a chart containing information about Covid-19 cases in the USA.  Please look at the chart and answer the question below.

Assume you trust the data used for the visualization. To what extent do you agree or disagree with the following statements about the visualization presented above? - I would likely use this visualization and its information in my actions tackling Covid-19","Above you see a chart containing information about Covid-19 cases in the USA.  Please look at the chart and answer the question below.

Assume you trust the data used for the visualization. To what extent do you agree or disagree with the following statements about the visualization presented above? - I trust this visualization","Tell us a bit more about why you  [QID140-ChoiceGroup-SelectedAnswers-11]  with the  statement ""I trust this visualization"".",Timing - First Click,Timing - Last Click,Timing - Page Submit,Timing - Click Count,"Above you see a chart containing information about Covid-19 cases in the USA. Please look at the chart and answer the question below.
What are your first/immediate impressions of this visualization? This could include things you like, dislike, as well as other first impressions.","Above you see a chart containing information about Covid-19 cases in the USA. Please look at the chart and answer the question below.

Disregard the visualization for this question. To what extent do you agree or disagree with the following statements about the data used in the visualization  above? - The data is accurate","Above you see a chart containing information about Covid-19 cases in the USA. Please look at the chart and answer the question below.

Disregard the visualization for this question. To what extent do you agree or disagree with the following statements about the data used in the visualization  above? - The data sufficiently describes the current state of COVID-19 vaccinations (the data is complete and does not leave out important information)","Above you see a chart containing information about Covid-19 cases in the USA. Please look at the chart and answer the question below.

Disregard the visualization for this question. To what extent do you agree or disagree with the following statements about the data used in the visualization  above? - The data is unbiased and trustworthy","Above you see a chart containing information about Covid-19 cases in the USA. Please look at the chart and answer the question below.

Disregard the visualization for this question. To what extent do you agree or disagree with the following statements about the data used in the visualization  above? - I understand the meaning of this data well","Above you see a chart containing information about Covid-19 cases in the USA. Please look at the chart and answer the question below.

Disregard the visualization for this question. To what extent do you agree or disagree with the following statements about the data used in the visualization  above? - The data source was clearly displayed","Above you see a chart containing information about Covid-19 cases in the USA. Please look at the chart and answer the question below.

Disregard the visualization for this question. To what extent do you agree or disagree with the following statements about the data used in the visualization  above? - I trust this data","Above you see a chart containing information about Covid-19 cases in the USA.  Please look at the chart and answer the question below.

Assume you trust the data used for the visualization. To what extent do you agree or disagree with the following statements about the visualization presented above? - The visualization transparently includes all important elements of the data","Above you see a chart containing information about Covid-19 cases in the USA.  Please look at the chart and answer the question below.

Assume you trust the data used for the visualization. To what extent do you agree or disagree with the following statements about the visualization presented above? - I find it easy to understand this visualization","Above you see a chart containing information about Covid-19 cases in the USA.  Please look at the chart and answer the question below.

Assume you trust the data used for the visualization. To what extent do you agree or disagree with the following statements about the visualization presented above? - I like this visualization","Above you see a chart containing information about Covid-19 cases in the USA.  Please look at the chart and answer the question below.

Assume you trust the data used for the visualization. To what extent do you agree or disagree with the following statements about the visualization presented above? - I would likely share this visualization with my family, friends or on social media","Above you see a chart containing information about Covid-19 cases in the USA.  Please look at the chart and answer the question below.

Assume you trust the data used for the visualization. To what extent do you agree or disagree with the following statements about the visualization presented above? - I would likely use this visualization and its information in my actions tackling Covid-19","Above you see a chart containing information about Covid-19 cases in the USA.  Please look at the chart and answer the question below.

Assume you trust the data used for the visualization. To what extent do you agree or disagree with the following statements about the visualization presented above? - I trust this visualization","Tell us a bit more about why you  [QID145-ChoiceGroup-SelectedAnswers-11]  with the  statement ""I trust this visualization"".",Timing - First Click,Timing - Last Click,Timing - Page Submit,Timing - Click Count,"Above you see a chart containing information about Covid-19 cases in the USA. Please look at the chart and answer the question below.
What are your first/immediate impressions of this visualization? This could include things you like, dislike, as well as other first impressions.","Above you see a chart containing information about Covid-19 cases in the USA. Please look at the chart and answer the question below.

Disregard the visualization for this question. To what extent do you agree or disagree with the following statements about the data used in the visualization  above? - The data is accurate","Above you see a chart containing information about Covid-19 cases in the USA. Please look at the chart and answer the question below.

Disregard the visualization for this question. To what extent do you agree or disagree with the following statements about the data used in the visualization  above? - The data sufficiently describes the current state of COVID-19 vaccinations (the data is complete and does not leave out important information)","Above you see a chart containing information about Covid-19 cases in the USA. Please look at the chart and answer the question below.

Disregard the visualization for this question. To what extent do you agree or disagree with the following statements about the data used in the visualization  above? - The data is unbiased and trustworthy","Above you see a chart containing information about Covid-19 cases in the USA. Please look at the chart and answer the question below.

Disregard the visualization for this question. To what extent do you agree or disagree with the following statements about the data used in the visualization  above? - I understand the meaning of this data well","Above you see a chart containing information about Covid-19 cases in the USA. Please look at the chart and answer the question below.

Disregard the visualization for this question. To what extent do you agree or disagree with the following statements about the data used in the visualization  above? - The data source was clearly displayed","Above you see a chart containing information about Covid-19 cases in the USA. Please look at the chart and answer the question below.

Disregard the visualization for this question. To what extent do you agree or disagree with the following statements about the data used in the visualization  above? - I trust this data","Above you see a chart containing information about Covid-19 cases in the USA.  Please look at the chart and answer the question below.

Assume you trust the data used for the visualization. To what extent do you agree or disagree with the following statements about the visualization presented above? - The visualization transparently includes all important elements of the data","Above you see a chart containing information about Covid-19 cases in the USA.  Please look at the chart and answer the question below.

Assume you trust the data used for the visualization. To what extent do you agree or disagree with the following statements about the visualization presented above? - I find it easy to understand this visualization","Above you see a chart containing information about Covid-19 cases in the USA.  Please look at the chart and answer the question below.

Assume you trust the data used for the visualization. To what extent do you agree or disagree with the following statements about the visualization presented above? - I like this visualization","Above you see a chart containing information about Covid-19 cases in the USA.  Please look at the chart and answer the question below.

Assume you trust the data used for the visualization. To what extent do you agree or disagree with the following statements about the visualization presented above? - I would likely share this visualization with my family, friends or on social media","Above you see a chart containing information about Covid-19 cases in the USA.  Please look at the chart and answer the question below.

Assume you trust the data used for the visualization. To what extent do you agree or disagree with the following statements about the visualization presented above? - I would likely use this visualization and its information in my actions tackling Covid-19","Above you see a chart containing information about Covid-19 cases in the USA.  Please look at the chart and answer the question below.

Assume you trust the data used for the visualization. To what extent do you agree or disagree with the following statements about the visualization presented above? - I trust this visualization","Tell us a bit more about why you  [QID150-ChoiceGroup-SelectedAnswers-11]  with the  statement ""I trust this visualization"".",Timing - First Click,Timing - Last Click,Timing - Page Submit,Timing - Click Count,PROLIFIC_PID,provenance-simple-bar-initial,provenance-simple-bar-data,provenance-simple-bar-vis,provenance-moderate-bar-initial,provenance-moderate-bar-data,provenance-moderate-bar-vis,provenance-complex-bar-initial,provenance-complex-bar-data,provenance-complex-bar-vis,provenance-simple-bar-tour,provenance-moderate-bar-tour,provenance-complex-bar-tour
